nutrient name,title,description
N,NITROGEN,"A part of every living cell, Nitrogen is essential to plant growth. Learn about the many roles this critical nutrient plays, including being a necessary component for chlorophyll synthesis and directly increasing protein content in plants.A part of every living cell, Nitrogen is essential to plant growth. Learn about the many roles this critical nutrient plays, including being a necessary component for chlorophyll synthesis and directly increasing protein content in plants.A part of every living cell, Nitrogen is essential to plant growth. Learn about the many roles this critical nutrient plays , including being a necessary component for chlorophyll synthesis and directly increasing protein content in plants.A part of every living cell, Nitrogen is essential to plant growth. Learn about the many roles this critical nutrient plays, including being a necessary component for chlorophyll synthesis and directly increasing protein content in plants."
P,PHOSPHORUS,"Without phosphorus, no plant can complete its normal production cycle. Find out why Phosphorus is often referred to as the ""energizer,"" and how its many roles make it one of the three primary nutrients for plant growth.Without phosphorus, no plant can complete its normal production cycle. Find out why Phosphorus is often referred to as the ""energizer,"" and how its many roles make it one of the three primary nutrients for plant growth.Without phosphorus, no plant can complete its normal production cycle. Find out why Phosphorus is often referred to as the ""energizer,"" and how its many roles make it one of the three primary nutrients for plant growth.Without phosphorus, no plant can complete its normal production cycle. Find out why Phosphorus is often referred to as the ""energizer,"" and how its many roles make it one of the three primary nutrients for plant growth.Without phosphorus, no plant can complete its normal production cycle. Find out why Phosphorus is often referred to as the ""energizer,"" and how its many roles make it one of the three primary nutrients for plant growth.Without phosphorus, no plant can complete its normal production cycle. Find out why Phosphorus is often referred to as the ""energizer,"" and how its many roles make it one of the three primary nutrients for plant growth.Without phosphorus, no plant can complete its normal production cycle. Find out why Phosphorus is often referred to as the ""energizer,"" and how its many roles make it one of the three primary nutrients for plant growth.Without phosphorus, no plant can complete its normal production cycle. Find out why Phosphorus is often referred to as the ""energizer,"" and how its many roles make it one of the three primary nutrients for plant growth.Without phosphorus, no plant can complete its normal production cycle. Find out why Phosphorus is often referred to as the ""energizer,"" and how its many roles make it one of the three primary nutrients for plant growth.Without phosphorus, no plant can complete its normal production cycle. Find out why Phosphorus is often referred to as the ""energizer,"" and how its many roles make it one of the three primary nutrients for plant growth.Without phosphorus, no plant can complete its normal production cycle. Find out why Phosphorus is often referred to as the ""energizer,"" and how its many roles make it one of the three primary nutrients for plant growth.Without phosphorus, no plant can complete its normal production cycle. Find out why Phosphorus is often referred to as the ""energizer,"" and how its many roles make it one of the three primary nutrients for plant growth.Without phosphorus, no plant can complete its normal production cycle. Find out why Phosphorus is often referred to as the ""energizer,"" and how its many roles make it one of the three primary nutrients for plant growth."
K,POTASSIUM,"From photosynthesis, to protein synthesis and more, Potassium is absolutely vital to the success of your crops. Discover why K earns its place in the ""holy trinity"" of Macronutrients (NPK) in our Nutrient Knowledge breakdown.From photosynthesis, to protein synthesis and more, Potassium is absolutely vital to the success of your crops. Discover why K earns its place in the ""holy trinity"" of Macronutrients (NPK) in our Nutrient Knowledge breakdown.From photosynthesis, to protein synthesis and more, Potassium is absolutely vital to the success of your crops. Discover why K earns its place in the ""holy trinity"" of Macronutrients (NPK) in our Nutrient Knowledge breakdown.From photosynthesis, to protein synthesis and more, Potassium is absolutely vital to the success of your crops. Discover why K earns its place in the ""holy trinity"" of Macronutrients (NPK) in our Nutrient Knowledge breakdown.From photosynthesis, to protein synthesis and more, Potassium is absolutely vital to the success of your crops. Discover why K earns its place in the ""holy trinity"" of Macronutrients (NPK) in our Nutrient Knowledge breakdown.From photosynthesis, to protein synthesis and more, Potassium is absolutely vital to the success of your crops. Discover why K earns its place in the ""holy trinity"" of Macronutrients (NPK) in our Nutrient Knowledge breakdown.From photosynthesis, to protein synthesis and more, Potassium is absolutely vital to the success of your crops. Discover why K earns its place in the ""holy trinity"" of Macronutrients (NPK) in our Nutrient Knowledge breakdown.From photosynthesis, to protein synthesis and more, Potassium is absolutely vital to the success of your crops. Discover why K earns its place in the ""holy trinity"" of Macronutrients (NPK) in our Nutrient Knowledge breakdown.From photosynthesis, to protein synthesis and more, Potassium is absolutely vital to the success of your crops. Discover why K earns its place in the ""holy trinity"" of Macronutrients (NPK) in our Nutrient Knowledge breakdown.From photosynthesis, to protein synthesis and more, Potassium is absolutely vital to the success of your crops. Discover why K earns its place in the ""holy trinity"" of Macronutrients (NPK) in our Nutrient Knowledge breakdown.From photosynthesis, to protein synthesis and more, Potassium is absolutely vital to the success of your crops. Discover why K earns its place in the ""holy trinity"" of Macronutrients (NPK) in our Nutrient Knowledge breakdown.From photosynthesis, to protein synthesis and more, Potassium is absolutely vital to the success of your crops. Discover why K earns its place in the ""holy trinity"" of Macronutrients (NPK) in our Nutrient Knowledge breakdown.From photosynthesis, to protein synthesis and more, Potassium is absolutely vital to the success of your crops. Discover why K earns its place in the ""holy trinity"" of Macronutrients (NPK) in our Nutrient Knowledge breakdown.From photosynthesis, to protein synthesis and more, Potassium is absolutely vital to the success of your crops. Discover why K earns its place in the ""holy trinity"" of Macronutrients (NPK) in our Nutrient Knowledge breakdown.From photosynthesis, to protein synthesis and more, Potassium is absolutely vital to the success of your crops. Discover why K earns its place in the ""holy trinity"" of Macronutrients (NPK) in our Nutrient Knowledge breakdown.From photosynthesis, to protein synthesis and more, Potassium is absolutely vital to the success of your crops. Discover why K earns its place in the ""holy trinity"" of Macronutrients (NPK) in our Nutrient Knowledge breakdown.From photosynthesis, to protein synthesis and more, Potassium is absolutely vital to the success of your crops. Discover why K earns its place in the ""holy trinity"" of Macronutrients (NPK) in our Nutrient Knowledge breakdown.From photosynthesis, to protein synthesis and more, Potassium is absolutely vital to the success of your crops. Discover why K earns its place in the ""holy trinity"" of Macronutrients (NPK) in our Nutrient Knowledge breakdown.From photosynthesis, to protein synthesis and more, Potassium is absolutely vital to the success of your crops. Discover why K earns its place in the ""holy trinity"" of Macronutrients (NPK) in our Nutrient Knowledge breakdown."
Mg,MAGNESIUM,"Hidden in the heart of each chlorophyll molecule is an atom of Magnesium. Learn how this unique nutrient plays an integral role in everything from photosynthesis, to phosphate metabolism to plant respiration and the activation of enzyme systems.Hidden in the heart of each chlorophyll molecule is an atom of Magnesium. Learn how this unique nutrient plays an integral role in everything from photosynthesis, to phosphate metabolism to plant respiration and the activation of enzyme systems.Hidden in the heart of each chlorophyll molecule is an atom of Magnesium. Learn how this unique nutrient plays an integral role in everything from photosynthesis, to phosphate metabolism to plant respiration and the activation of enzyme systems.Hidden in the heart of each chlorophyll molecule is an atom of Magnesium. Learn how this unique nutrient plays an integral role in everything from photosynthesis, to phosphate metabolism to plant respiration and the activation of enzyme systems."
S,SULFUR,"Sulfur is a part of every living cell and is important to the formation of proteins, yet it is often present in insufficient quantities for the needs of high-yielding crops. Explore how and when Sulfur can be used to get the most out of your crop.Sulfur is a part of every living cell and is important to the formation of proteins, yet it is often present in insufficient quantities for the needs of high-yielding crops. Explore how and when Sulfur can be used to get the most out of your crop.Sulfur is a part of every living cell and is important to the formation of proteins, yet it is often present in insufficient quantities for the needs of high-yielding crops. Explore how and when Sulfur can be used to get the most out of your crop.Sulfur is a part of every living cell and is important to the formation of proteins, yet it is often present in insufficient quantities for the needs of high-yielding crops. Explore how and when Sulfur can be used to get the most out of your crop."
Ca,CALCIUM,"Calcium is found all around us, and the very existence of plants and animals depends on it. Find out why this underrated secondary nutrient is one that should never be ignored.Calcium is found all around us, and the very existence of plants and animals depends on it. Find out why this underrated secondary nutrient is one that should never be ignored.Calcium is found all around us, and the very existence of plants and animals depends on it. Find out why this underrated secondary nutrient is one that should never be ignored."
B,BORON,"Discover why Boron is essential for cell wall formation and rapid growing points within plants, and the impact that can have on improving plant health.Discover why Boron is essential for cell wall formation and rapid growing points within plants, and the impact that can have on improving plant health.Discover why Boron is essential for cell wall formation and rapid growing points within plants, and the impact that can have on improving plant health.Discover why Boron is essential for cell wall formation and rapid growing points within plants, and the impact that can have on improving plant health."
Cl,CHLORINE,"Even though it's only needed in small quantities, Chlorine is a required component for all plants. Learn how this valuable micronutrient is active in everything from energy reactions, to regulating stomatal regulation.Even though it's only needed in small quantities, Chlorine is a required component for all plants. Learn how this valuable micronutrient is active in everything from energy reactions, to regulating stomatal regulation.Even though it's only needed in small quantities, Chlorine is a required component for all plants. Learn how this valuable micronutrient is active in everything from energy reactions, to regulating stomatal regulation.Even though it's only needed in small quantities, Chlorine is a required component for all plants. Learn how this valuable micronutrient is active in everything from energy reactions, to regulating stomatal regulation.Even though it's only needed in small quantities, Chlorine is a required component for all plants. Learn how this valuable micronutrient is active in everything from energy reactions, to regulating stomatal regulation.Even though it's only needed in small quantities, Chlorine is a required component for all plants. Learn how this valuable micronutrient is active in everything from energy reactions, to regulating stomatal regulation.Even though it's only needed in small quantities, Chlorine is a required component for all plants. Learn how this valuable micronutrient is active in everything from energy reactions, to regulating stomatal regulation.Even though it's only needed in small quantities, Chlorine is a required component for all plants. Learn how this valuable micronutrient is active in everything from energy reactions, to regulating stomatal regulation.Even though it's only needed in small quantities, Chlorine is a required component for all plants. Learn how this valuable micronutrient is active in everything from energy reactions, to regulating stomatal regulation.Even though it's only needed in small quantities, Chlorine is a required component for all plants. Learn how this valuable micronutrient is active in everything from energy reactions, to regulating stomatal regulation.Even though it's only needed in small quantities, Chlorine is a required component for all plants. Learn how this valuable micronutrient is active in everything from energy reactions, to regulating stomatal regulation."
Mn,MANGANESE,"With the power to accelerate germination and maturity, while increasing Phosphorus and Calcium availability, Manganese is one micronutrient with giant benefits.With the power to accelerate germination and maturity, while increasing Phosphorus and Calcium availability, Manganese is one micronutrient with giant benefits.With the power to accelerate germination and maturity, while increasing Phosphorus and Calcium availability, Manganese is one micronutrient with giant benefits.With the power to accelerate germination and maturity, while increasing Phosphorus and Calcium availability, Manganese is one micronutrient with giant benefits."
Fe,IRON,"From energy transfer, nitrogen reduction and fixation, to lignin formation, learn how Iron is a key component of the enzymes essential for growth and food production.From energy transfer, nitrogen reduction and fixation, to lignin formation, learn how Iron is a key component of the enzymes essential for growth and food production.From energy transfer, nitrogen reduction and fixation, to lignin formation, learn how Iron is a key component of the enzymes essential for growth and food production.From energy transfer, nitrogen reduction and fixation, to lignin formation, learn how Iron is a key component of the enzymes essential for growth and food production."
Ni,NICKEL,"It may only be needed in very small amounts, but without Nickel, urea conversion is impossible, making it an important part of Nitrogen metabolism. Learn more about this recent addition to the list of essential plant nutrients.It may only be needed in very small amounts, but without Nickel, urea conversion is impossible, making it an important part of Nitrogen metabolism. Learn more about this recent addition to the list of essential plant nutrients.It may only be needed in very small amounts, but without Nickel, urea conversion is impossible, making it an important part of Nitrogen metabolism. Learn more about this recent addition to the list of essential plant nutrients.It may only be needed in very small amounts, but without Nickel, urea conversion is impossible, making it an important part of Nitrogen metabolism. Learn more about this recent addition to the list of essential plant nutrients."
Cu,COPPER,"It may only be needed in very small amounts, but without Nickel, urea conversion is impossible, making it an important part of Nitrogen metabolism. Learn more about this recent addition to the list of essential plant nutrients.It may only be needed in very small amounts, but without Nickel, urea conversion is impossible, making it an important part of Nitrogen metabolism. Learn more about this recent addition to the list of essential plant nutrients.It may only be needed in very small amounts, but without Nickel, urea conversion is impossible, making it an important part of Nitrogen metabolism. Learn more about this recent addition to the list of essential plant nutrients.It may only be needed in very small amounts, but without Nickel, urea conversion is impossible, making it an important part of Nitrogen metabolism. Learn more about this recent addition to the list of essential plant nutrients."
Zn,ZINC,Want high-yields? Then you're gonna need a little Zinc. Find out why this incredible micronutrient was one of the first to be recognized as essential for plants and plant growth.Want high-yields? Then you're gonna need a little Zinc. Find out why this incredible micronutrient was one of the first to be recognized as essential for plants and plant growth.Want high-yields? Then you're gonna need a little Zinc. Find out why this incredible micronutrient was one of the first to be recognized as essential for plants and plant growth.Want high-yields? Then you're gonna need a little Zinc. Find out why this incredible micronutrient was one of the first to be recognized as essential for plants and plant growth.Want high-yields? Then you're gonna need a little Zinc. Find out why this incredible micronutrient was one of the first to be recognized as essential for plants and plant growth.Want high-yields? Then you're gonna need a little Zinc. Find out why this incredible micronutrient was one of the first to be recognized as essential for plants and plant growth.Want high-yields? Then you're gonna need a little Zinc. Find out why this incredible micronutrient was one of the first to be recognized as essential for plants and plant growth.Want high-yields? Then you're gonna need a little Zinc. Find out why this incredible micronutrient was one of the first to be recognized as essential for plants and plant growth.Want high-yields? Then you're gonna need a little Zinc. Find out why this incredible micronutrient was one of the first to be recognized as essential for plants and plant growth.Want high-yields? Then you're gonna need a little Zinc. Find out why this incredible micronutrient was one of the first to be recognized as essential for plants and plant growth.Want high-yields? Then you're gonna need a little Zinc. Find out why this incredible micronutrient was one of the first to be recognized as essential for plants and plant growth.Want high-yields? Then you're gonna need a little Zinc. Find out why this incredible micronutrient was one of the first to be recognized as essential for plants and plant growth.Want high-yields? Then you're gonna need a little Zinc. Find out why this incredible micronutrient was one of the first to be recognized as essential for plants and plant growth.Want high-yields? Then you're gonna need a little Zinc. Find out why this incredible micronutrient was one of the first to be recognized as essential for plants and plant growth.
Mo,MOLYBDENUM,"It may be just a trace element found in the soil, but it's absolutely required for the synthesis and activity of the enzyme nitrate reductase. Learn why Molybdenum is so important for optimizing plant growth.It may be just a trace element found in the soil, but it's absolutely required for the synthesis and activity of the enzyme nitrate reductase. Learn why Molybdenum is so important for optimizing plant growth.It may be just a trace element found in the soil, but it's absolutely required for the synthesis and activity of the enzyme nitrate reductase. Learn why Molybdenum is so important for optimizing plant growth.It may be just a trace element found in the soil, but it's absolutely required for the synthesis and activity of the enzyme nitrate reductase. Learn why Molybdenum is so important for optimizing plant growth.It may be just a trace element found in the soil, but it's absolutely required for the synthesis and activity of the enzyme nitrate reductase. Learn why Molybdenum is so important for optimizing plant growth.It may be just a trace element found in the soil, but it's absolutely required for the synthesis and activity of the enzyme nitrate reductase. Learn why Molybdenum is so important for optimizing plant growth.It may be just a trace element found in the soil, but it's absolutely required for the synthesis and activity of the enzyme nitrate reductase. Learn why Molybdenum is so important for optimizing plant growth.It may be just a trace element found in the soil, but it's absolutely required for the synthesis and activity of the enzyme nitrate reductase. Learn why Molybdenum is so important for optimizing plant growth.It may be just a trace element found in the soil, but it's absolutely required for the synthesis and activity of the enzyme nitrate reductase. Learn why Molybdenum is so important for optimizing plant growth.It may be just a trace element found in the soil, but it's absolutely required for the synthesis and activity of the enzyme nitrate reductase. Learn why Molybdenum is so important for optimizing plant growth.It may be just a trace element found in the soil, but it's absolutely required for the synthesis and activity of the enzyme nitrate reductase. Learn why Molybdenum is so important for optimizing plant growth.It may be just a trace element found in the soil, but it's absolutely required for the synthesis and activity of the enzyme nitrate reductase. Learn why Molybdenum is so important for optimizing plant growth.It may be just a trace element found in the soil, but it's absolutely required for the synthesis and activity of the enzyme nitrate reductase. Learn why Molybdenum is so important for optimizing plant growth.It may be just a trace element found in the soil, but it's absolutely required for the synthesis and activity of the enzyme nitrate reductase. Learn why Molybdenum is so important for optimizing plant growth.It may be just a trace element found in the soil, but it's absolutely required for the synthesis and activity of the enzyme nitrate reductase. Learn why Molybdenum is so important for optimizing plant growth.It may be just a trace element found in the soil, but it's absolutely required for the synthesis and activity of the enzyme nitrate reductase. Learn why Molybdenum is so important for optimizing plant growth.It may be just a trace element found in the soil, but it's absolutely required for the synthesis and activity of the enzyme nitrate reductase. Learn why Molybdenum is so important for optimizing plant growth."
H,HYDROGEN,"One of the major building blocks of life, Hydrogen is one of three primary elements plants use in the largest amounts. Learn more about its role in plant growth.One of the major building blocks of life, Hydrogen is one of three primary elements plants use in the largest amounts. Learn more about its role in plant growth.One of the major building blocks of life, Hydrogen is one of three primary elements plants use in the largest amounts. Learn more about its role in plant growth.One of the major building blocks of life, Hydrogen is one of three primary elements plants use in the largest amounts. Learn more about its role in plant growth."
C,CARBON,Carbon is responsible for all life on earth. Explore how plants use CO? from the atmosphere to build essential biological compounds such as carbohydrates and proteins.Carbon is responsible for all life on earth. Explore how plants use CO? from the atmosphere to build essential biological compounds such as carbohydrates and proteins.Carbon is responsible for all life on earth. Explore how plants use CO? from the atmosphere to build essential biological compounds such as carbohydrates and proteins.Carbon is responsible for all life on earth. Explore how plants use CO? from the atmosphere to build essential biological compounds such as carbohydrates and proteins.
O,OXYGEN,"Oxygen is responsible for cellular respiration in plants. Learn more about the role of this critical element in photosynthesis, and how it is both stored for energy and released as a byproduct.Oxygen is responsible for cellular respiration in plants. Learn more about the role of this critical element in photosynthesis, and how it is both stored for energy and released as a byproduct.Oxygen is responsible for cellular respiration in plants. Learn more about the role of this critical element in photosynthesis, and how it is both stored for energy and released as a byproduct.Oxygen is responsible for cellular respiration in plants. Learn more about the role of this critical element in photosynthesis, and how it is both stored for energy and released as a byproduct."
